{
  "budget": [
    "当初予算額",
    "補正予算額",
    "継続費及び繰越事業費繰越額",
    "予備費支出及び流用増減",
    "計"
  ],
  "executed": [
    "支出済額",
    "翌年度繰越額",
    "不用額"
  ],
  "header_top": 120.0,
  "row_tol": 2.0,
  "name_gap": 2.0,
  "path_right": 140.0,
  "budget_bands": [
    [
      134.0,
      205.0
    ],
    [
      209.0,
      275.0
    ],
    [
      299.0,
      340.0
    ],
    [
      359.0,
      395.0
    ],
    [
      399.0,
      460.0
    ]
  ],
  "setsu_left": 455.0,
  "setsu_right": 850.0,
  "setsu_mark_right": 475.0,
  "setsu_name_left": 460.0,
  "setsu_amount_bands": [
    [
      530.0,
      605.0
    ],
    [
      605.0,
      672.0
    ],
    [
      735.0,
      778.0
    ],
    [
      786.0,
      848.0
    ]
  ],
  "subject_exec_bands": [
    [
      604.0,
      672.0
    ],
    [
      740.0,
      775.0
    ],
    [
      790.0,
      845.0
    ]
  ],
  "note_left": 848.0,
  "project_mark_right": 858.0,
  "note_setsu_mark_right": 876.0,
  "note_amount_min_right": 1110.0
}
